<?xml version="1.0" encoding="UTF-8"?>
<constraints xmlns="http://www.fbk.eu/WSDLConstraints"
	xmlns:xsi="http://www.w3.org/2001/XMLSchema-instance"
	xsi:schemaLocation="http://www.fbk.eu/WSDLConstraints WSDLConstraints.xsd ">
	<onElement xpath="//findItemsByKeywordsResponse/searchResult/item/itemId" name="title">
		<restriction base="string">
			<minLength value="5"/>
			<maxLength value="256"/>
		</restriction>
	</onElement>
	<onElement xpath="//findItemsByKeywordsResponse/searchResult/item/title" name="title">
		<restriction base="string">
			<whiteSpace value="collapse"/>
		</restriction>
	</onElement>
	<onElement xpath="//findItemsByKeywordsResponse/searchResult/item/globalId" name="globalId">
		<restriction base="string">
			<enumeration value="EBAY-AT"/>
			<enumeration value="EBAY-AU"/>
			<enumeration value="EBAY-CH"/>
			<enumeration value="EBAY-DE"/>
			<enumeration value="EBAY-ENCA"/>
			<enumeration value="EBAY-ES"/>
			<enumeration value="EBAY-FR"/>
			<enumeration value="EBAY-FRBE"/>
			<enumeration value="EBAY-FRCA"/>
			<enumeration value="EBAY-GB"/>
			<enumeration value="EBAY-HK"/>
			<enumeration value="EBAY-IE"/>
			<enumeration value="EBAY-IN"/>
			<enumeration value="EBAY-IT"/>
			<enumeration value="EBAY-MOTOR"/>
			<enumeration value="EBAY-MY"/>
			<enumeration value="EBAY-NL"/>
			<enumeration value="EBAY-NLBE"/>
			<enumeration value="EBAY-PH"/>
			<enumeration value="EBAY-PL"/>
			<enumeration value="EBAY-SG"/>
			<enumeration value="EBAY-US"/>
		</restriction>
	</onElement>
	<onElement xpath="//findItemsByKeywordsResponse/searchResult/item/condition/conditionId" name="conditionId">
		<restriction base="string">
			<enumeration value="Used"/>
			<enumeration value="New"/>
			<enumeration value="Unspecified"/>
		</restriction>
	</onElement>
	<onElement xpath="//searchResult/item/primaryCategory/categoryId" name="categoryId">
		<restriction base="integer">
			<maxInclusive value="99999"/>
			<minInclusive value="0"/>
		</restriction>
	</onElement>
	<onElement xpath="//searchResult/item/paymentMethod" name="paymentMethod">
		<restriction base="string">
			<enumeration value="AmEx"/>
			<enumeration value="CashInPerson"/>
			<enumeration value="CashOnPickup"/>
			<enumeration value="CCAccepted"/>
			<enumeration value="COD"/>
			<enumeration value="CODPrePayDelivery"/>
			<enumeration value="CustomCode"/>
			<enumeration value="Discover"/>
			<enumeration value="ELV"/>
			<enumeration value="Escrow"/>
			<enumeration value="LoanCheck"/>
			<enumeration value="MOCC"/>
			<enumeration value="Moneybookers"/>
			<enumeration value="MoneyXferAccepted"/>
			<enumeration value="MoneyXferAcceptedInCheckout"/>
			<enumeration value="None"/>
			<enumeration value="Other"/>
			<enumeration value="OtherOnlinePayments"/>
			<enumeration value="PaisaPayAccepted"/>
			<enumeration value="PaisaPayEscrowEMI"/>
			<enumeration value="Paymate"/>
			<enumeration value="PaymentSeeDescription"/>
			<enumeration value="PayPal"/>
			<enumeration value="PersonalCheck"/>
			<enumeration value="PostalTransfer"/>
			<enumeration value="PrePayDelivery"/>
			<enumeration value="ProPay"/>
			<enumeration value="VisaMC"/>
		</restriction>
	</onElement>
	<onElement xpath="//searchResult/item/sellingStatus/timeLeft" name="timeLeft">
		<restriction base="string">
			<pattern value="P[0-9]{2}DT[1-2]?[0-9]H[1-5]?[0-9]M[1-5]?[0-9]S"/>
		</restriction>
	</onElement>
	<onElement xpath="//searchResult/item/shippingInfo/shippingType" name="shippingType">
		<restriction base="string">
			<enumeration value="Calculated"/>
			<enumeration value="CalculatedDomesticFlatInternational"/>
			<enumeration value="Flat"/>
			<enumeration value="FlatDomesticCalculatedInternational"/>
			<enumeration value="Free"/>
			<enumeration value="FreePickup"/>
			<enumeration value="Freight"/>
			<enumeration value="FreightFlat"/>
			<enumeration value="NotSpecified"/>
		</restriction>
	</onElement>
</constraints>
